id	text
421	A snapshot of sports analytics in sport: routines, nerves, and the way tiny adjustments decide matches. It reads like sideline notes, mixing tactics with the stubborn joy that keeps athletes coming back.
436	A note about problem decomposition in maths: start from simple cases, look for invariants, and name the structure you find. The aim is clarity over cleverness, with examples that travel well.
134	On recycling challenges in environment, this paragraph tracks everyday interventions that compound over years. It emphasizes pragmatic steps, local context, and the patience required for durable change.
245	Concerning reproducibility in science, this passage traces how careful methods and transparent records turn ideas into evidence. It values small wins and the craft behind reliable results.
484	On water stewardship in environment, this paragraph tracks everyday interventions that compound over years. It emphasizes pragmatic steps, local context, and the patience required for durable change.
477	Focused on migration routes in history, this sketch follows threads across time rather than reciting dates. It asks who kept the records, who was left out, and how interpretations shift.
260	This note reflects coalition building in politics, sketching how small choices ripple through institutions. It favors concrete examples over slogans, weighing trade‑offs and showing how people build consensus when goals collide.
331	A snapshot of fan culture in sport: routines, nerves, and the way tiny adjustments decide matches. It reads like sideline notes, mixing tactics with the stubborn joy that keeps athletes coming back.
463	A brief on assessment design in education: how classrooms adapt, what feedback loops work, and why pacing matters. It collects small practices that make learning stick without flashy gimmicks.
381	A snapshot of team chemistry in sport: routines, nerves, and the way tiny adjustments decide matches. It reads like sideline notes, mixing tactics with the stubborn joy that keeps athletes coming back.
87	Focused on local archives in history, this sketch follows threads across time rather than reciting dates. It asks who kept the records, who was left out, and how interpretations shift.
282	Here the focus is player accessibility within gaming, where players test ideas, fail fast, and share tricks. It hints at design intent and the community habits that turn mechanics into stories.
1	A snapshot of team chemistry in sport: routines, nerves, and the way tiny adjustments decide matches. It reads like sideline notes, mixing tactics with the stubborn joy that keeps athletes coming back.
377	Focused on oral traditions in history, this sketch follows threads across time rather than reciting dates. It asks who kept the records, who was left out, and how interpretations shift.
166	A note about problem decomposition in maths: start from simple cases, look for invariants, and name the structure you find. The aim is clarity over cleverness, with examples that travel well.
239	A vignette about haunted houses in fiction: two sentences linger on a detail, then the scene pivots. It trusts subtext, leaving space for the reader to finish the moment.
386	A note about optimization ideas in maths: start from simple cases, look for invariants, and name the structure you find. The aim is clarity over cleverness, with examples that travel well.
135	Concerning citizen science in science, this passage traces how careful methods and transparent records turn ideas into evidence. It values small wins and the craft behind reliable results.
105	Concerning citizen science in science, this passage traces how careful methods and transparent records turn ideas into evidence. It values small wins and the craft behind reliable results.
256	A note about graph thinking in maths: start from simple cases, look for invariants, and name the structure you find. The aim is clarity over cleverness, with examples that travel well.
392	Here the focus is game balancing within gaming, where players test ideas, fail fast, and share tricks. It hints at design intent and the community habits that turn mechanics into stories.
163	A brief on edtech tools in education: how classrooms adapt, what feedback loops work, and why pacing matters. It collects small practices that make learning stick without flashy gimmicks.
300	This note reflects ethics in office in politics, sketching how small choices ripple through institutions. It favors concrete examples over slogans, weighing trade‑offs and showing how people build consensus when goals collide.
83	A brief on active learning in education: how classrooms adapt, what feedback loops work, and why pacing matters. It collects small practices that make learning stick without flashy gimmicks.
368	Regarding island biogeography in geography, the piece ties physical patterns to livelihoods. It reads maps like narratives, showing how terrain nudges routes, borders, and everyday choices.
446	A note about number theory patterns in maths: start from simple cases, look for invariants, and name the structure you find. The aim is clarity over cleverness, with examples that travel well.
206	A note about problem decomposition in maths: start from simple cases, look for invariants, and name the structure you find. The aim is clarity over cleverness, with examples that travel well.
126	A note about geometry constructions in maths: start from simple cases, look for invariants, and name the structure you find. The aim is clarity over cleverness, with examples that travel well.
144	On recycling challenges in environment, this paragraph tracks everyday interventions that compound over years. It emphasizes pragmatic steps, local context, and the patience required for durable change.
145	Concerning grant writing in science, this passage traces how careful methods and transparent records turn ideas into evidence. It values small wins and the craft behind reliable results.
